{
  "chapter_id": "CH124",
  "arc_id": "ARC013",
  "mode": "DRAFT",
  "viewpoint": "C001",
  "target_words": {
    "min": 2800,
    "max": 3800
  },
  "max_truth_level": 2,
  "required_modules": [
    "MOD-RULE-AIRWOMB",
    "MOD-RULE-AUTHORIZATION",
    "MOD-CHAR-REMNANTCORE"
  ],
  "include_recent_chapters": 3,
  "objectives": [
    "核實換班工梁石、既有卸料門及兩側承托",
    "沿實際界力接觸解析獨立糧架，不搬倉地或借城主戰",
    "趁敵軍強令推糧在外臺建立有限接應，押運者仍受隔閘阻擋"
  ],
  "prohibitions": [
    "右臂不得恢復，秦無漏不得借城主戰",
    "通訊與意願不能替代實際交割門和生命錨控制",
    "痛泉不得加人擴載",
    "不得解釋陌生座標的上層真相"
  ],
  "output_language": "zh-Hant",
  "notes": "依第120章及逐章已寫初稿續接；規則來源為世界鐵律與第121至130章細綱。原生Harness未支援ARC013，使用回溯開寫包與人工覆核；DRAFT不合併canon。"
}
